{
  "id": "django-setup",
  "name": "Django Setup Agent",
  "category": "setup",
  "type": "django-setup",
  "version": "1.0.0",
  "description": "Specialized agent for setting up Django applications with REST framework, PostgreSQL, authentication, and production configurations",
  "icon": "django",
  "color": "#092E20",
  "instructions": {
    "base": "You are a Django framework specialist. Your role is to create robust Django applications with proper project structure, REST APIs, database models, authentication, and deployment configurations.",
    "contextual": "Set up a Django project: {{projectName}} with database: {{database}}, API: {{useRestFramework}}, and features: {{features}}."
  },
  "claudeMD": "# Django Setup Agent\n\nSpecializes in Django application setup:\n- Django 5.x with Python 3.11+\n- Django REST Framework\n- PostgreSQL/MySQL integration\n- Authentication & permissions\n- Admin interface customization\n- Celery task queue setup\n- Docker configuration\n\n## Core Competencies\n- Project structure\n- Model design\n- View and serializer creation\n- URL routing\n- Middleware configuration\n- Static files handling\n- Testing with pytest",
  "inputs": [
    {
      "name": "projectName",
      "type": "string",
      "required": true,
      "description": "Name of the Django project"
    },
    {
      "name": "database",
      "type": "string",
      "required": false,
      "description": "Database type (postgres, mysql, sqlite)",
      "default": "postgres"
    },
    {
      "name": "useRestFramework",
      "type": "boolean",
      "required": false,
      "description": "Include Django REST Framework",
      "default": true
    },
    {
      "name": "usecelery",
      "type": "boolean",
      "required": false,
      "description": "Include Celery for async tasks",
      "default": false
    }
  ],
  "outputs": [
    {
      "name": "projectPath",
      "type": "string",
      "description": "Path to created Django project"
    },
    {
      "name": "managePy",
      "type": "string",
      "description": "Path to manage.py script"
    },
    {
      "name": "settings",
      "type": "object",
      "description": "Django settings configuration"
    }
  ],
  "hooks": {
    "Stop": [
      {
        "hooks": [
          {
            "type": "command",
            "command": "$CLAUDE_PROJECT_DIR/hooks/stop.sh --node-id $NODE_ID --status $STATUS --output-type setup"
          }
        ]
      }
    ],
    "PostToolUse": [
      {
        "matcher": "Write|Edit",
        "hooks": [
          {
            "type": "command",
            "command": "$CLAUDE_PROJECT_DIR/hooks/track-changes.sh --node-id $NODE_ID"
          }
        ]
      }
    ]
  },
  "resources": {
    "estimatedTime": 12,
    "estimatedTokens": 50000,
    "requiresGPU": false,
    "maxRetries": 3,
    "memory": "2GB",
    "cpu": "2 cores"
  },
  "dependencies": [],
  "tags": ["django", "python", "backend", "api", "rest", "framework", "orm"]
}